id,title,description,image_link,link,google_product_category,brand,price,currency,availability,item_group_id,checkout_url,additional_image_link,sale_price_effective_date,sale_price,condition
"1131","Acumulator extern Remax RUJ, 2400 mAh, cablu micro usb inclus, power bank","Intrare: 5V 1.0A
	Iesire: 5V 1.0A
.","http://www.pluscomputer.ro/image/catalog/periferice/power bank remax ruj.png","http://www.pluscomputer.ro/index.php?route=product/product&product_id=1131","Power Banks","Remax","49 RON","RON","in stock","1131","http://www.pluscomputer.ro/index.php?route=product/product&product_id=1131","http://www.pluscomputer.ro/image/catalog/periferice/power bank remax ruj toate.png,http://www.pluscomputer.ro/image/catalog/periferice/power bank remax ruj ambalaj.png","1970-01-30T00:00+00:00/2038-01-17T23:59+00:00","45 RON","new"
"1487","Adaptor / Mufa de prelungire cablu HDMI,  Active, mama-mama, prelungitor hdmi, negru"," Un adaptor de calitate in ambalaj individualSuporta rezolutie HDTV de pana la 1080","http://www.pluscomputer.ro/image/catalog/cabluri/hdmi mama mama.jpg","http://www.pluscomputer.ro/index.php?route=product/product&product_id=1487","HDMI","Active","15 RON","RON","in stock","1487","http://www.pluscomputer.ro/index.php?route=product/product&product_id=1487","","1970-01-30T00:00+00:00/2038-01-17T23:59+00:00","13 RON","new"
"1697","Adaptor / Mufa de prelungire cablu retea cat6, UTP / FTP / RJ45, Active, mama-mama, prelungitor cabl","Perfect pentru a prelungi un cablu de retea cu mufa RJ45, UTP, FTP.Cat.6e.","http://www.pluscomputer.ro/image/catalog/retelistica/mufe/mufa cat6 prelungire alb.jpg","http://www.pluscomputer.ro/index.php?route=product/product&product_id=1697","Cable / Connectors","Active","10 RON","RON","out of stock","1697","http://www.pluscomputer.ro/index.php?route=product/product&product_id=1697","http://www.pluscomputer.ro/image/catalog/retelistica/mufe/mufa cat6 prelungire alb2.jpg,http://www.pluscomputer.ro/image/catalog/retelistica/mufe/mufa prelungire cat6.jpg","1970-01-30T00:00+00:00/2038-01-17T23:59+00:00","8 RON","new"
"1488","Adaptor / Mufa de prelungire cablu retea UTP / FTP / RJ45,  Active, mama-mama, prelungitor"," Perfect pentru a prelungi un cablu de retea cu mufa RJ45, UTP, FTP.","http://www.pluscomputer.ro/image/catalog/cabluri/mufa rj45 prelungitor.jpg","http://www.pluscomputer.ro/index.php?route=product/product&product_id=1488","Cable / Connectors","Active","3 RON","RON","in stock","1488","http://www.pluscomputer.ro/index.php?route=product/product&product_id=1488","http://www.pluscomputer.ro/image/catalog/retelistica/mufe/set 10 mufe prelungitoare retea.jpg","1970-01-30T00:00+00:00/1970-01-30T23:59+00:00","3 RON","new"
"1774","Adaptor / Mufa HDMI unghi 90 grade, ACTIVE, mama-tata, negru, contacte aurite, ambalaj individual","Mufa HDMI mama tata la unghi de 90 grade cu contacte auriteConformitate: HDCP, HDMI Authority, RoHSVersiunea HDMI: v1.4 si 100% compatibila cu HDMI v1.1, v1.2 si v1.3Rezolutie maxima suportata: 4096 x 2160p Ultra HD / Dual Stream 1080p 3DAmbalaj: Individual 1Buc.","http://www.pluscomputer.ro/image/catalog/cabluri/video/mufa hdmi 90grade tata mama0.jpg","http://www.pluscomputer.ro/index.php?route=product/product&product_id=1774","HDMI","Active","15 RON","RON","in stock","1774","http://www.pluscomputer.ro/index.php?route=product/product&product_id=1774","http://www.pluscomputer.ro/image/catalog/cabluri/video/mufa hdmi 90grade tata mama1.jpg","1970-01-30T00:00+00:00/2038-01-17T23:59+00:00","9 RON","new"
"5","Adaptor alimentare molex (ide)- 2 x SATA 15cm, multiplicator s-ata","ADAPTOR / Multiplicator ALIMENTARE  de la molex (ide) la 2 x sata","http://www.pluscomputer.ro/image/catalog/storeimages/2925499_1517776239333.jpg","http://www.pluscomputer.ro/index.php?route=product/product&product_id=5","Internal Cables","Active","10 RON","RON","in stock","5","http://www.pluscomputer.ro/index.php?route=product/product&product_id=5","http://www.pluscomputer.ro/image/","1970-01-30T00:00+00:00/2038-01-17T23:59+00:00","8 RON","new"
"3","Adaptor alimentare molex (ide)- SATA 15cm","ADAPTOR ALIMENTARE  de la molex (ide) la sata","http://www.pluscomputer.ro/image/catalog/storeimages/2925457_151777623936.png","http://www.pluscomputer.ro/index.php?route=product/product&product_id=3","Internal Cables","Active","7 RON","RON","in stock","3","http://www.pluscomputer.ro/index.php?route=product/product&product_id=3","http://www.pluscomputer.ro/image/","1970-01-30T00:00+00:00/2038-01-17T23:59+00:00","5 RON","new"
"7","Adaptor alimentare placa video pci-e 6 pini de la molex, cablu pcie 6pini","ADAPTOR ALIMENTARE  de la molex (ide) la la pci-e 6 pinLunhime: 15cm

.","http://www.pluscomputer.ro/image/catalog/storeimages/3099618_1517776239723.png","http://www.pluscomputer.ro/index.php?route=product/product&product_id=7","Internal Cables","DeTech","10 RON","RON","in stock","7","http://www.pluscomputer.ro/index.php?route=product/product&product_id=7","http://www.pluscomputer.ro/image/","1970-01-30T00:00+00:00/2038-01-17T23:59+00:00","8 RON","new"
"8","Adaptor alimentare placa video pci-e 6 pini de la s-ata, cablu sata la pci-e 6pini","ADAPTOR ALIMENTARE  de la sata la pci-e 6 pin","http://www.pluscomputer.ro/image/catalog/cabluri/cablu video 6 pin sata.jpg","http://www.pluscomputer.ro/index.php?route=product/product&product_id=8","Internal Cables","Active","15 RON","RON","in stock","8","http://www.pluscomputer.ro/index.php?route=product/product&product_id=8","http://www.pluscomputer.ro/image/","1970-01-30T00:00+00:00/2038-01-17T23:59+00:00","13 RON","new"
"1713","Adaptor alimentare placa video pci-e 6+2 pini de la 1 x s-ata, Active, 20cm, cablu data pcie 8pini","ADAPTOR ALIMENTARE  de la sata la pci-e 8 pin (6+2) mama, 20cm.","http://www.pluscomputer.ro/image/catalog/cabluri/pci-e/cablu pcie 8 pini de la sata.jpg","http://www.pluscomputer.ro/index.php?route=product/product&product_id=1713","Internal Cables","Active","20 RON","RON","in stock","1713","http://www.pluscomputer.ro/index.php?route=product/product&product_id=1713","","1970-01-30T00:00+00:00/2038-01-17T23:59+00:00","12 RON","new"
"1688","Adaptor alimentare s-ata - 2 x molex (ide) 20cm, Active, sursa sata tata la 2 x molex mama spliter","Adaptor ALIMENTARE de la s-ata tata la 2 x  molex mama cu lungime de 20cm.","http://www.pluscomputer.ro/image/catalog/cabluri/cablu sata 2 x molex ok.jpg","http://www.pluscomputer.ro/index.php?route=product/product&product_id=1688","Internal Cables","Active","15 RON","RON","in stock","1688","http://www.pluscomputer.ro/index.php?route=product/product&product_id=1688","http://www.pluscomputer.ro/image/","1970-01-30T00:00+00:00/2038-01-17T23:59+00:00","12 RON","new"
"4","Adaptor alimentare s-ata - molex (ide) 17cm, Active, sursa sata mama la molex tata","Adaptor ALIMENTARE de la s-ata mama la molex tata cu lungime de 17cm.","http://www.pluscomputer.ro/image/catalog/storeimages/3340290_1517776239594.jpg","http://www.pluscomputer.ro/index.php?route=product/product&product_id=4","Internal Cables","Active","9 RON","RON","in stock","4","http://www.pluscomputer.ro/index.php?route=product/product&product_id=4","http://www.pluscomputer.ro/image/","1970-01-30T00:00+00:00/2038-01-17T23:59+00:00","8 RON","new"
"1761","Adaptor audio Digital la Analog, Active, convertor SPDIF Toslink la RCA si Jack 3.5mm, alimentare 5v","Acest convertor audio digital la analog (din televizor spre sistem audio) este proiectat pentru comutarea audio sau audio profesionala. Converteste semnalul audio digital coaxial sau Toslink la RCA analogic L / R si jack audio de 3,5 stereo (nu si invers). Ofera transmisie electromagnetica fara zgomot.Acest convertor este de dimensiuni mici si destul de usor de instalat. Conectati la televizor cablul Toslink din pachet (numit si Digital SPDIF sau Cablu optic), apoi conectati la iesire sistemul de boxe audio (sau casti) pe mufa RCA sau jack stereo de 3,5 mm. Conectati cablul de alimentare USB inclus in pachet.ATENTIE: Acest convertor nu amplifica semnalul audio, daca doriti sa montati boxe mai mari la televizor, acestea trebuie sa fie active (cu amplificator/statie).Specificatii:Conector audio de intrare: Toslink, RCA coaxialConector audio de iesire: RCA (R / L), Jack 3,5 mm Culoare: neagraGreutate: 63gDimensiune (Lxlxi): 65x42x26Alimentare: 5V 0.5A (conectat prin cablu de alimentare USB)Rata de esantionare: 32KHz, 44.1KHz, 48KHz si 96KHzFluxul de biti de intrare: SPDIF de 24 de biti pe canalele din stanga si din dreaptaPachetul contine: Convertorul Toslink, Cablu audio digital Toslink, Cablu USB alimentare 5V, manual de utilizare in limba romana","http://www.pluscomputer.ro/image/catalog/cabluri/audio/adaptor toslink.jpg","http://www.pluscomputer.ro/index.php?route=product/product&product_id=1761","Adapter Cables","Active","99 RON","RON","in stock","1761","http://www.pluscomputer.ro/index.php?route=product/product&product_id=1761","http://www.pluscomputer.ro/image/catalog/cabluri/audio/adaptor toslink 4.jpg,http://www.pluscomputer.ro/image/catalog/cabluri/audio/adaptor toslink 2.jpg,http://www.pluscomputer.ro/image/catalog/cabluri/audio/adaptor toslink 3.jpg","1970-01-30T00:00+00:00/2038-01-17T23:59+00:00","90 RON","new"
"1849","Adaptor AV la HDMI, Active, Full HD, convertor 3 x RCA analog la hdmi digital cu mufa video si sunet","Atentie, functioneaza doar pe aceasta directie:  de la DVD cu mufa AV/RCA (sau consola joc ps3 sau xbox 360), spre televizor cu mufa HDMI (sau monitor, videoproiector, etc) , NU SI INVERS. Pentru directia inversa, vezi ""Adaptor HDMI la AV""Intrare semnal in adaptor: 3 x RCA (de la: dvd, ps3 sau xbox 360)Iesire semnal din adaptor: HDMI (spre: Televizor, monitor, videoproiector, etc)Adaptorul AV la HDMI este un convertor universal cu intrare analogica AV ( 3 x RCA) si iesire digitala HDMI (60Hz)Convertirea analog-digital cu detectarea automata si conversia automata a semnalului, puteti conecta dispozitive modele mai vechi cu RCA la televizoare/monitoare modele noi cu HDMI. Plug and Play, nu necesita drivere. Buton switch pentru rezolutie 720P sau 1080P (fara conversie)Aveti nevoie de un cablu AV la intrare si un cablu HDMI la iesire. Contine cablu alimentare USB 5V.Compatibil cu HDMI 1.4","http://www.pluscomputer.ro/image/catalog/cabluri/adaptoare/adaptor av la hdmi.jpg","http://www.pluscomputer.ro/index.php?route=product/product&product_id=1849","HDMI","Active","65 RON","RON","in stock","1849","http://www.pluscomputer.ro/index.php?route=product/product&product_id=1849","http://www.pluscomputer.ro/image/catalog/cabluri/adaptoare/adaptor av la hdmi 2.jpg,http://www.pluscomputer.ro/image/catalog/cabluri/adaptoare/adaptor av la hdmi 3.jpg","1970-01-30T00:00+00:00/2038-01-17T23:59+00:00","55 RON","new"
"1889","Adaptor AV la VGA, Active, Full HD, convertor analog 3 x RCA la VGA cu mufa video si sunet audio mam","Atentie, functioneaza doar pe aceasta directie:  de la DVD cu mufa AV/RCA (sau consola joc ps3 sau xbox 360), spre televizor cu mufa HDMI (sau monitor, videoproiector, etc) , NU SI INVERS. Pentru directia inversa, vezi ""Adaptor VGA la AV""Intrare semnal in adaptor: 3 x RCA (de la: dvd, ps3 sau xbox 360)Iesire semnal din adaptor: VGA (spre: Televizor, monitor, videoproiector, etc)Adaptorul AV la VGA este un convertor universal analog cu intrare AV ( 3 x RCA) si iesire VGAConversia automata a semnalului cu detectarea automata, puteti conecta dispozitive modele mai vechi cu RCA la televizoare/monitoare modele mai vechi cu VGA. Plug and Play, nu necesita drivere. Buton switch pentru NTFS/PALAveti nevoie de un cablu 3xRCA la intrare si un cablu VGA la iesire. Contine cablu alimentare USB 5V.","http://www.pluscomputer.ro/image/catalog/cabluri/video/av rca/adaptor av la vga.jpg","http://www.pluscomputer.ro/index.php?route=product/product&product_id=1889","VGA","Active","60 RON","RON","in stock","1889","http://www.pluscomputer.ro/index.php?route=product/product&product_id=1889","http://www.pluscomputer.ro/image/catalog/cabluri/video/av rca/adaptor av la vga 4.jpg,http://www.pluscomputer.ro/image/catalog/cabluri/video/av rca/adaptor av la vga 2.jpg,http://www.pluscomputer.ro/image/catalog/cabluri/video/av rca/adaptor av la vga 3.jpg","1970-01-30T00:00+00:00/2038-01-17T23:59+00:00","49 RON","new"
"1839","Adaptor BNC la HDMI, Active, Full HD, convertor bnc analog la hdmi digital cu mufa video si sunet au","Atentie, functioneaza doar pe aceasta directie:  de la dvr camere supraveghere cu mufa BNC (sau cablu coaxial TV), spre televizor cu mufa HDMI (sau monitor, videoproiector, etc) , NU SI INVERS. Pentru directia inversa, vezi ""Adaptor HDMI la BNC""Intrare semnal in adaptor: BNC  (de la: DVR camere supraveghere, sau cablu tv coaxial)Iesire semnal din adaptor: HDMI (spre: Televizor, monitor, videoproiector, etc)Adaptorul BNC la HDMI este un convertor universal cu intrare analogica BNC si iesire digitala HDMI (60Hz)Convertirea analog-digital cu detectarea automata si conversia automata a semnalului, puteti conecta dispozitive modele analog cu BNC sau Coaxial la televizoare/monitoare modele noi cu HDMI. Plug and Play, nu necesita drivere. Buton switch pentru standarde tv PAL si NTSC la intrare. Suporta rezolutie maxima FHD.Aveti nevoie de un cablu BNC sau coaxial cu mufa bnc la intrare si un cablu HDMI la iesire. Contine cablu alimentare USB 5V.Compatibil cu HDMI 1.4Rezolutii HDMI suportate:640x480@60Hz, 800x600@60Hz, 1024x768@60Hz, 1280x720@60Hz, 1280x1024@60Hz, 1360x768@60Hz, 1600x1200@60Hz, 1920x1080@60Hz, 576p/60Hz, 720p50/60Hz, 1080i50/60Hz, 1080p23.97/24/25/50/59.94/60Hz.","http://www.pluscomputer.ro/image/catalog/cabluri/video/bnc/adaptor bnc la hdmi.jpg","http://www.pluscomputer.ro/index.php?route=product/product&product_id=1839","CCTV","Active","150 RON","RON","in stock","1839","http://www.pluscomputer.ro/index.php?route=product/product&product_id=1839","http://www.pluscomputer.ro/image/catalog/cabluri/video/bnc/adaptor bnc hdmi 1.jpg,http://www.pluscomputer.ro/image/catalog/cabluri/video/bnc/adaptor bnc hdmi 2.jpg","1970-01-30T00:00+00:00/2038-01-17T23:59+00:00","130 RON","new"
"1607","Adaptor Cablu audio Jack 2 x 3.5mm 3 pin Tata (microfon + casti/ boxe) la 1 x jack 3.5mm 4 pin Mama ","Cablu audio Jack 2 x 3.5mm 3 pin Tata (microfon + casti/ boxe) la 1 x jack 3.5mm 4 pin Mama - 20cmCu acest cablu puteti avea la castile prevazute cu 1 mufa jack 4 pini Tata, 2 mufe jack 3 pini Tata pentru microfon si casti, pentru a le putea folosi la dispositive prevazute cu 2 intrari separate pentru casti/boxe si microfon (calculator, laptop,...)","http://www.pluscomputer.ro/image/catalog/cabluri/cablu 2 x jack tata la 1 x ajck mama 2.png","http://www.pluscomputer.ro/index.php?route=product/product&product_id=1607","Audio Cables","DeTech","20 RON","RON","in stock","1607","http://www.pluscomputer.ro/index.php?route=product/product&product_id=1607","","1970-01-30T00:00+00:00/2038-01-17T23:59+00:00","15 RON","new"
"1872","Adaptor Cablu audio Jack 2 x 3.5mm 3 pin Tata (microfon + casti/ boxe) la 1 x jack 3.5mm 4 pin Mama ","Cablu audio Jack 2 x 3.5mm 3 pin Tata (microfon + casti/ boxe) la 1 x jack 3.5mm 4 pin Mama - 20cmCu acest cablu puteti avea la castile prevazute cu 1 mufa jack 4 pini Tata, 2 mufe jack 3 pini Tata pentru microfon si casti, pentru a le putea folosi la dispositive prevazute cu 2 intrari separate pentru casti/boxe si microfon (calculator, laptop,...)","http://www.pluscomputer.ro/image/catalog/cabluri/audio/cablu audio jack spliter 18210  2 tata.jpg","http://www.pluscomputer.ro/index.php?route=product/product&product_id=1872","Audio Cables","DeTech","20 RON","RON","in stock","1872","http://www.pluscomputer.ro/index.php?route=product/product&product_id=1872","http://www.pluscomputer.ro/image/catalog/cabluri/audio/cablu audio spliter 18210.jpg","1970-01-30T00:00+00:00/2038-01-17T23:59+00:00","15 RON","new"
"1567","Adaptor Cablu audio Jack 3.5mm 4 pini Tata ( telefon) la 2 x 3.5mm 3 pin Mama (microfon + casti/ box","Cu acest cablu puteti avea la dispozitive prevazute cu 1 mufa jack 4 pini mama, 2 mufe jack tata 3 pini pentru microfon si casti, pentru a putea folosi la telefon/laptop/tableta/consola  casti si microfon de calculator.","http://www.pluscomputer.ro/image/catalog/cabluri/audio/cablu audio jack 4pin NA.jpg","http://www.pluscomputer.ro/index.php?route=product/product&product_id=1567","Adapter Cables","Active","20 RON","RON","in stock","1567","http://www.pluscomputer.ro/index.php?route=product/product&product_id=1567","","1970-01-30T00:00+00:00/2038-01-17T23:59+00:00","15 RON","new"
"1594","Adaptor Cablu audio Jack 3.5mm 4 pini Tata ( telefon) la 2 x 3.5mm 3 pin Mama (microfon + casti/ box","Cu acest cablu puteti avea la dispozitive prevazute cu 1 mufa jack 4 pini mama, 2 mufe jack tata 3 pini pentru microfon si casti, pentru a putea folosi la telefon/laptop/tableta/consola  casti si microfon de calculator.","http://www.pluscomputer.ro/image/catalog/cabluri/adaptor-stereo-jack-35mm-tata---2-x-jack-35mm-mama.jpg","http://www.pluscomputer.ro/index.php?route=product/product&product_id=1594","Adapter Cables","Active","20 RON","RON","out of stock","1594","http://www.pluscomputer.ro/index.php?route=product/product&product_id=1594","","1970-01-30T00:00+00:00/2038-01-17T23:59+00:00","15 RON","new"
"1838","Adaptor Cablu audio Jack 3.5mm 4 pini Tata ( telefon) la 2 x 3.5mm 3 pin Mama (microfon + casti/ box","Cu acest cablu puteti avea la dispozitive prevazute cu 1 mufa jack 4 pini mama, 2 mufe jack tata 3 pini pentru microfon si casti, pentru a putea folosi la telefon/laptop/tableta/consola  casti si microfon de calculator.","http://www.pluscomputer.ro/image/catalog/cabluri/audio/cablu jack 4 pin 18211 negru.png","http://www.pluscomputer.ro/index.php?route=product/product&product_id=1838","Adapter Cables","DeTech","20 RON","RON","in stock","1838","http://www.pluscomputer.ro/index.php?route=product/product&product_id=1838","","1970-01-30T00:00+00:00/2038-01-17T23:59+00:00","15 RON","new"
"1805","Adaptor Cablu audio Jack Active, 2 x 3.5mm 3 pin Tata (microfon + casti/ boxe) la 1 x jack 3.5mm 4 p","Cablu audio Jack 2 x 3.5mm 3 pin Tata (microfon + casti/ boxe) la 1 x jack 3.5mm 4 pin Mama - 20cmCu acest cablu puteti avea la castile prevazute cu 1 mufa jack 4 pini Tata, 2 mufe jack 3 pini Tata, pentru microfon si casti, pentru a le putea folosi la dispositive prevazute cu 2 intrari separate pentru casti/boxe si microfon (calculator, laptop,...)","http://www.pluscomputer.ro/image/catalog/cabluri/audio/cablu jack 4 pin mama.jpg","http://www.pluscomputer.ro/index.php?route=product/product&product_id=1805","Audio Cables","Active","20 RON","RON","in stock","1805","http://www.pluscomputer.ro/index.php?route=product/product&product_id=1805","","1970-01-30T00:00+00:00/2038-01-17T23:59+00:00","13 RON","new"
"1760","Adaptor Cablu audio optic digital Toslink mama la mini Toslink tata Active, mufa conectori auriti, n","Adaptorul audio digital Toslink mama la mini Toslink tata cu conectori auriti previne coroziunea si asigura o protectie maxima a varfului fibrei.Transforma o mufa Toslink tata intr-o mufa mini Toslink tata.Compatibil cu orice cablu cu fibra optica audio Toslink tata.Tehnologia audio digitala Toslink va ofera cel mai curat semnal posibil chiar si la niveluri de volum extrem.Detine conectori auriti pentru a previni coroziunea si pentru o protectie maxima a varfului fibrei.","http://www.pluscomputer.ro/image/catalog/cabluri/audio/adaptor toslink minitoslink.jpg","http://www.pluscomputer.ro/index.php?route=product/product&product_id=1760","Audio Cables","Active","10 RON","RON","in stock","1760","http://www.pluscomputer.ro/index.php?route=product/product&product_id=1760","http://www.pluscomputer.ro/image/catalog/cabluri/audio/mini toslink.jpg","1970-01-30T00:00+00:00/2038-01-17T23:59+00:00","6 RON","new"
"1425","Adaptor DisplayPort (DP) la HDMI Active, calitate deosebita, suporta rezolutie 4k UHD","DisplayPort tata la HDMI mama, 30cm
	Un cablu de calitate deosebita
	Suporta rezolutie 4k.
	ATENTIE: Functioneaza doar de la DisplayPort (laptop, placa video pc, ...) la HDMI (monitor, tv,...), NU SI INVERS
 ","http://www.pluscomputer.ro/image/catalog/storeimages/1965875_1517607945466.jpg","http://www.pluscomputer.ro/index.php?route=product/product&product_id=1425","DisplayPort","Active","55 RON","RON","in stock","1425","http://www.pluscomputer.ro/index.php?route=product/product&product_id=1425","","1970-01-30T00:00+00:00/2038-01-17T23:59+00:00","50 RON","new"
"1424","Adaptor DisplayPort (DP) la HDMI Active, suporta rezolutie Full HD","DisplayPort tata la HDMI mama, 30cm
	Un cablu de calitate deosebita
	Suporta rezolutie HDTV de pana la 1080
	ATENTIE: Functioneaza doar de la DisplayPort (laptop, placa video pc, ...) la HDMI (monitor, tv,...), NU SI INVERS
 ","http://www.pluscomputer.ro/image/catalog/cabluri/adaptoare/adaptor displayport hdmi 2.jpg","http://www.pluscomputer.ro/index.php?route=product/product&product_id=1424","DisplayPort","Active","35 RON","RON","in stock","1424","http://www.pluscomputer.ro/index.php?route=product/product&product_id=1424","http://www.pluscomputer.ro/image/catalog/cabluri/adaptoare/adaptor displayport hdmi.jpg,http://www.pluscomputer.ro/image/catalog/cabluri/video/aaptor displayport hdmi 18219.jpg","1970-01-30T00:00+00:00/2038-01-17T23:59+00:00","32 RON","new"
"1422","Adaptor DisplayPort (DP) tata - DVI analog Mama 24+5pin Active, suporta rezolutie full HD, mufa cabl","DisplayPort tata la dvi analog 18+5pin mama, 30cm
	Un cablu de calitate deosebita
	Suporta rezolutie HDTV de pana la 1080
	ATENTIE: Functioneaza doar de la DisplayPort (laptop, placa video pc, ...) la DVI (monitor, tv,...) NU SI INVERS
 ","http://www.pluscomputer.ro/image/catalog/storeimages/2775977_1517607944728.jpg","http://www.pluscomputer.ro/index.php?route=product/product&product_id=1422","DVI","Active","49 RON","RON","in stock","1422","http://www.pluscomputer.ro/index.php?route=product/product&product_id=1422","","1970-01-30T00:00+00:00/2038-01-17T23:59+00:00","39 RON","new"
"1423","Adaptor DisplayPort (DP) tata - DVI-D Mama 18+1pin Active, suporta rezolutie full HD, mufa cablu dvi","DisplayPort tata la dvi digital 18+1 mama, 30cm
	Un cablu de calitate deosebita
	Suporta rezolutie HDTV de pana la 1080
	ATENTIE: Functioneaza doar de la DisplayPort (laptop, placa video pc, ...) la DVI digital (monitor, tv,...), NU SI INVERS
 ","http://www.pluscomputer.ro/image/catalog/storeimages/2169854_151760794537.png","http://www.pluscomputer.ro/index.php?route=product/product&product_id=1423","DVI","Active","35 RON","RON","in stock","1423","http://www.pluscomputer.ro/index.php?route=product/product&product_id=1423","","1970-01-30T00:00+00:00/2038-01-17T23:59+00:00","30 RON","new"
"1421","Adaptor DisplayPort (DP) tata - VGA Mama, Active, suporta rezolutie full HD","DisplayPort tata la VGA mama, 20cm
	Un cablu de calitate deosebita
	Suporta rezolutie HDTV de pana la 1080
	ATENTIE: Functioneaza doar de la DisplayPort (laptop, placa video pc, ...) la VGA (monitor, tv,...), NU SI INVERS
 ","http://www.pluscomputer.ro/image/catalog/storeimages/2221543_151760794457.jpg","http://www.pluscomputer.ro/index.php?route=product/product&product_id=1421","DisplayPort","Active","49 RON","RON","in stock","1421","http://www.pluscomputer.ro/index.php?route=product/product&product_id=1421","","1970-01-30T00:00+00:00/2038-01-17T23:59+00:00","39 RON","new"
"1430","Adaptor DVI-D (24+1pin) tata la HDMI mama Active, mufa dvi digital, negru","Un adaptor de calitate superioara in ambalaj individual
	Suporta rezolutie HDTV de pana la 1080
	24+1pini
 ","http://www.pluscomputer.ro/image/catalog/storeimages/2783060_1517607945772.jpg","http://www.pluscomputer.ro/index.php?route=product/product&product_id=1430","DVI","Active","15 RON","RON","in stock","1430","http://www.pluscomputer.ro/index.php?route=product/product&product_id=1430","","1970-01-30T00:00+00:00/2038-01-17T23:59+00:00","13 RON","new"
"1695","Adaptor DVI-D 24+1 pin Dual Link tata la VGA 15pin Mama, Active, suporta rezolutie full HD, converto","DVI Digital la VGA mama, 20cmUn cablu de calitate deosebitaSuporta rezolutie HDTV de pana la 1080ATENTIE: Functioneaza doar de la DVI-D (laptop, placa video pc, ...) la VGA (monitor, tv,...), NU SI INVERS","http://www.pluscomputer.ro/image/catalog/ADAPTOARE/adaptor dvi-d la vga.jpg","http://www.pluscomputer.ro/index.php?route=product/product&product_id=1695","DVI","Active","49 RON","RON","in stock","1695","http://www.pluscomputer.ro/index.php?route=product/product&product_id=1695","","1970-01-30T00:00+00:00/2038-01-17T23:59+00:00","39 RON","new"
"1428","Adaptor DVI-I analogic tata la VGA mama ACTIVE 24+5pini, mufa dvi analog","Un adaptor de calitate superioara
	Suporta rezolutie HDTV de pana la 1080
	24+5 pini
 ","http://www.pluscomputer.ro/image/catalog/cabluri/adaptor dvii-vga active.jpg","http://www.pluscomputer.ro/index.php?route=product/product&product_id=1428","DVI","Active","10 RON","RON","in stock","1428","http://www.pluscomputer.ro/index.php?route=product/product&product_id=1428","","1970-01-30T00:00+00:00/2038-01-17T23:59+00:00","8 RON","new"
"1429","Adaptor DVI-I analogic tata la VGA mama DeTech 24+5pini, mufa dvi analog","Un adaptor de calitate superioara
	Suporta rezolutie HDTV de pana la 1080
	24+5 pini
 ","http://www.pluscomputer.ro/image/catalog/cabluri/adaptor dvii-vga.jpg","http://www.pluscomputer.ro/index.php?route=product/product&product_id=1429","DVI","DeTech","12 RON","RON","out of stock","1429","http://www.pluscomputer.ro/index.php?route=product/product&product_id=1429","","1970-01-30T00:00+00:00/2038-01-17T23:59+00:00","10 RON","new"
